{
  "adjustment_date": "2026-07-31",
  "effective_from": "2026-08-01T00:00:00+08:00",
  "timezone": "Asia/Shanghai",
  "unit": "CNY/L",
  "currency": "CNY",
  "products": [
    "89",
    "92",
    "95",
    "0"
  ],
  "provinces": [
    {
      "province_code": "110000",
      "province_name": "北京市",
      "sources": [
        {
          "name": "北京市发展和改革委员会",
          "url": "https://fgw.beijing.gov.cn/fgwzwgk/2024zcwj/bwqtwj/202607/t20260731_4803356.htm",
          "notice_id": "beijing-https-fgw-beijing-gov-cn-fgwzwgk-2024zcwj-bwqtwj-202607-t20260731-4803356-htm",
          "title": "本市成品油价格调整",
          "raw_sha256": "aa97c67ca5c8c75bae394a4cb161990b1110f1737bbbc05daae959fa7a306f96",
          "adapter": "beijing",
          "parser_version": "beijing-v1",
          "extracted_at": "2026-08-13T10:30:13+08:00",
          "published_at": "2026-07-31",
          "adjustment_date": "2026-07-31",
          "confidence": "high"
        }
      ],
      "zones": [
        {
          "zone_code": "default",
          "zone_name": "默认价区",
          "items": {
            "89": 7.46,
            "92": 7.97,
            "95": 8.48,
            "0": 7.69
          },
          "missing_products": []
        }
      ]
    },
    {
      "province_code": "120000",
      "province_name": "天津市",
      "sources": [
        {
          "name": "天津市发展和改革委员会",
          "url": "https://fzgg.tj.gov.cn/xxfb/tzggx/202607/t20260731_7345550.html",
          "notice_id": "tianjin-https-fzgg-tj-gov-cn-xxfb-tzggx-202607-t20260731-7345550-html",
          "title": "天津市发展改革委关于调整我市成品油价格的公告 2026-07-31",
          "raw_sha256": "32bfa457e2356c691cc905bbafab9f46b78e2a499bbfd79cdba906e68a393503",
          "adapter": "generic",
          "parser_version": "generic-v1",
          "extracted_at": "2026-08-13T10:30:17+08:00",
          "published_at": "2026-07-31",
          "adjustment_date": "2026-07-31",
          "confidence": "medium"
        }
      ],
      "zones": [
        {
          "zone_code": "default",
          "zone_name": "默认价区",
          "items": {
            "89": 7.38,
            "92": 7.96,
            "95": 8.41,
            "0": 7.64
          },
          "missing_products": []
        }
      ]
    },
    {
      "province_code": "130000",
      "province_name": "河北省",
      "sources": [
        {
          "name": "河北省发展和改革委员会",
          "url": "https://hbdrc.hebei.gov.cn/gggs_980/202607/t20260731_137664.html",
          "notice_id": "hebei-https-hbdrc-hebei-gov-cn-gggs-980-202607-t20260731-137664-html",
          "title": "关于调整成品油价格的公告（2026年第14号）",
          "raw_sha256": "8e7fd8f1205292241ee62e610ff8b1158fea2923a78888eba3cbbef5d748801a",
          "adapter": "hebei",
          "parser_version": "hebei-v1",
          "extracted_at": "2026-08-13T10:30:48+08:00",
          "published_at": "2026-07-31",
          "adjustment_date": "2026-07-31",
          "confidence": "medium"
        }
      ],
      "zones": [
        {
          "zone_code": "default",
          "zone_name": "默认价区",
          "items": {
            "89": 7.38,
            "92": 7.96,
            "95": 8.41,
            "0": 7.64
          },
          "missing_products": []
        }
      ]
    },
    {
      "province_code": "140000",
      "province_name": "山西省",
      "sources": [
        {
          "name": "山西省发展和改革委员会",
          "url": "https://fgw.shanxi.gov.cn/tzgg/202607/t20260731_10188531.shtml",
          "notice_id": "shanxi-https-fgw-shanxi-gov-cn-tzgg-202607-t20260731-10188531-shtml",
          "title": "关于调整我省成品油零售价格的公告",
          "raw_sha256": "7e95ea9d27711ccd9876770390be151b610ee03dae3d44ce9fc37be031e1dc42",
          "adapter": "shanxi",
          "parser_version": "shanxi-v1",
          "extracted_at": "2026-08-13T10:30:51+08:00",
          "published_at": "2026-07-31",
          "adjustment_date": "2026-07-31",
          "confidence": "medium"
        }
      ],
      "zones": [
        {
          "zone_code": "default",
          "zone_name": "默认价区",
          "items": {
            "89": 7.41,
            "92": 7.92,
            "95": 8.54,
            "0": 7.71
          },
          "missing_products": []
        }
      ]
    },
    {
      "province_code": "150000",
      "province_name": "内蒙古自治区",
      "sources": [
        {
          "name": "内蒙古自治区发展和改革委员会",
          "url": "https://fgw.nmg.gov.cn/ywgz/jfgz/cpyjg/202607/t20260731_2935848.html",
          "notice_id": "neimenggu-https-fgw-nmg-gov-cn-ywgz-jfgz-cpyjg-202607-t20260731-2935848-html",
          "title": "我区成品油价格调整",
          "raw_sha256": "4d3c7b4f5d24e180f754de3a1953e6ca52a319413bb9f3682cb79655502a1318",
          "adapter": "neimenggu",
          "parser_version": "neimenggu-v1",
          "extracted_at": "2026-08-13T10:30:57+08:00",
          "published_at": "2026-07-31",
          "adjustment_date": "2026-07-31",
          "confidence": "low"
        }
      ],
      "zones": [
        {
          "zone_code": "east",
          "zone_name": "东部价区",
          "items": {
            "92": 8.03,
            "95": 8.55,
            "0": 7.5
          },
          "missing_products": [
            "89"
          ]
        },
        {
          "zone_code": "west",
          "zone_name": "西部价区",
          "items": {
            "92": 7.97,
            "95": 8.47,
            "0": 7.49
          },
          "missing_products": [
            "89"
          ]
        }
      ]
    },
    {
      "province_code": "210000",
      "province_name": "辽宁省",
      "sources": [
        {
          "name": "辽宁省发展和改革委员会",
          "url": "https://fgw.ln.gov.cn/uiFramework/js/pdfjs/web/viewer.html?file=/fgw/articleFileDir/2026-07/31/4c08f6f1a3004781972f3402066448ff/2026073115234837059.pdf",
          "notice_id": "liaoning-ticlefiledir-2026-07-31-4c08f6f1a3004781972f3402066448ff-2026073115234837059-pdf",
          "title": "辽宁省成品油价格调整公告（2026年7月31日24时起执行）",
          "raw_sha256": "5f218e15adc1f1372f2eda0aeb32abbc6514c29754080982a8912fd4ed61fe67",
          "adapter": "liaoning",
          "parser_version": "liaoning-v1",
          "extracted_at": "2026-08-13T10:33:11+08:00",
          "published_at": "2026-07-31",
          "adjustment_date": "2026-07-31",
          "confidence": "medium"
        }
      ],
      "zones": [
        {
          "zone_code": "default",
          "zone_name": "默认价区",
          "items": {
            "89": 7.39,
            "92": 7.96,
            "95": 8.41,
            "0": 7.64
          },
          "missing_products": []
        }
      ]
    },
    {
      "province_code": "220000",
      "province_name": "吉林省",
      "sources": [
        {
          "name": "吉林省发展和改革委员会",
          "url": "https://jldrc.jl.gov.cn/ztzl/nyzyjg/202608/t20260804_3653690.html",
          "notice_id": "jilin-https-jldrc-jl-gov-cn-ztzl-nyzyjg-202608-t20260804-3653690-html",
          "title": "吉林省成品油最高零售价格表（2026年7月31日24时起执行）",
          "raw_sha256": "50a8bc5ca93f8a2fcdbec842e9ba3fd98392b71495c902de7fa413373e46b4e2",
          "adapter": "generic",
          "parser_version": "generic-v1",
          "extracted_at": "2026-08-13T10:33:15+08:00",
          "published_at": "2026-08-04",
          "adjustment_date": "2026-07-31",
          "confidence": "medium"
        }
      ],
      "zones": [
        {
          "zone_code": "default",
          "zone_name": "默认价区",
          "items": {
            "92": 7.93,
            "95": 8.56,
            "0": 7.55
          },
          "missing_products": [
            "89"
          ]
        }
      ]
    },
    {
      "province_code": "230000",
      "province_name": "黑龙江省",
      "sources": [
        {
          "name": "黑龙江省发展和改革委员会",
          "url": "https://drc.hlj.gov.cn/drc/c111486/202607/c00_31963395.shtml",
          "notice_id": "heilongjiang-https-drc-hlj-gov-cn-drc-c111486-202607-c00-31963395-shtml",
          "title": "我省调整成品油价格",
          "raw_sha256": "f51df707dccc6bf89023c37b8011652f7f6f278f4428bddf21c8bad8ad54ce04",
          "adapter": "heilongjiang",
          "parser_version": "heilongjiang-v1",
          "extracted_at": "2026-08-13T10:33:19+08:00",
          "published_at": "2026-07-31",
          "adjustment_date": "2026-07-31",
          "confidence": "low"
        }
      ],
      "zones": [
        {
          "zone_code": "default",
          "zone_name": "默认价区",
          "items": {
            "89": 7.54,
            "92": 8.0,
            "95": 8.54
          },
          "missing_products": [
            "0"
          ]
        }
      ]
    },
    {
      "province_code": "310000",
      "province_name": "上海市",
      "sources": [
        {
          "name": "上海市发展和改革委员会",
          "url": "https://fgw.sh.gov.cn/fgw_jggl/20260731/e7be6d140f7b4ae49e64b7d9cbac58ee.html",
          "notice_id": "shanghai-https-fgw-sh-gov-cn-fgw-jggl-20260731-e7be6d140f7b4ae49e64b7d9cbac58ee-html",
          "title": "上海市发展和改革委员会关于车用汽、柴油价格的通知（2026年7月31日）",
          "raw_sha256": "32d0b6c1abbe184a8ac4f59612f9c1b8b4eb31d35bce503603bf00fdc501f57f",
          "adapter": "generic",
          "parser_version": "generic-v1",
          "extracted_at": "2026-08-13T10:33:23+08:00",
          "published_at": "2026-07-31",
          "adjustment_date": "2026-07-31",
          "confidence": "medium"
        }
      ],
      "zones": [
        {
          "zone_code": "default",
          "zone_name": "默认价区",
          "items": {
            "89": 7.4,
            "92": 7.93,
            "95": 8.44,
            "0": 7.62
          },
          "missing_products": []
        }
      ]
    },
    {
      "province_code": "320000",
      "province_name": "江苏省",
      "sources": [
        {
          "name": "江苏省发展和改革委员会",
          "url": "https://fzggw.jiangsu.gov.cn/art/2026/7/31/art_284_11811304.html",
          "notice_id": "jiangsu-https-fzggw-jiangsu-gov-cn-art-2026-7-31-art-284-11811304-html",
          "title": "江苏省成品油价格调整公告（2026年第14号）",